Unnamed: 0,path,photo,url,identifier,date,language,topleveldomain,category,sentences
23,/media/ruben/Data Drive/react-data/protest/carlo-batch/11/11_1/html/ac89cff6-a13f-4238-9e72-bf5261770d6b.html_https://athens.indymedia.org/post/806536/,11.0,https://athens.indymedia.org/post/806536/,ac89cff6-a13f-4238-9e72-bf5261770d6b,2007-12-19,el,athens.indymedia.org,news,"από @||19/12/2007 11:58 πμ.||ως προβοκάτορας όχι των||μπάτσων όμως νομίζω||αλλά ως προβοκάτορας||με την έννοια ότι ορμώμενος από μια διαστραμμένη προσωπική του λογική προσπαθούσε να||απομακρύνει τις πέτρες||γυρω από τον||τζιουλιάνι με σκοπό να μη φανεί ότι||είχε γίνει σύγκρουση και να διαγράψει ακριβώς την ίδια||την επιλογή της σύγκρουσης||που τόσες χιλιάδες είχαν επιλέξει.||μη συγκρίνεις όμως τη λογική που έχουν||διαφορετικά κινήματα||ανά τον κόσμο και ήταν μαζεμένα||εκεί με τη δική σου ή τη λογική που σε ανάλογες περιπτώσεις επικράτησε στον ελλαδικό||χώρο ως απάντηση σε τέτοια εξόφθαλμα γεγονότα κατασταλτικής κρατικής βίας.||επίσης μην ξεχνάς τα πογκρόμ που ακολούθησαν και||τις επιθέσεις της||αστυνομίας σε||ό,τι κινείται.||από ange1096||19/12/2007 12:01||μμ.||δεν νομιζω ότι||έταξε ο||οποιοσδήποτε κάτι στον||giuliani για να πάρει τον πυροσβεστήρα και||να προσπαθήσει να||(αμυνθεί; τον πετάξει μέσα στο τζιπ; εκφοβίσει τους καραμπινιέρους που είχαν τραβήξει πιστόλι; κανείς δεν θα το μάθει).||η όλη ιστορία ήταν καθαρή προβοκάτσια.||φαίνεται και||από τις κινήσεις των δυνάμεων||καταστολής πριν από||το γεγονός.||όσο περισσότερο το σκέφτομαι, τόσο πείθομαι για τα λόγια του ferrario.||επίσης, σαν παζλ||, μπαίνουν στη θέση τους πολλά άλλα πράγματα||που συνέβησαν αμέσως μετά.||για παράδειγμα,||το ότι σε ελάχιστο χρόνο από τη δολοφονία εμφανίστηκε ολοφυρόμενος ένας δημοσιογράφος (υποδιευθυντής μιας κωλοφυλλάδας του μπερλουσκόνι, ο||οποίος στη συνέχεια αποβλήθηκε||από το συνδικαλιστικό||όργανο του ιταλικού τύπου γιατί αποδείχθηκε ότι πληρωνόταν από τις ιταλικές μυστικές υπηρεσίες).||για παράδειγμα, ότι το τζιπάκι των καραμπινιέρων αφέθηκε||να ξεμοναχιαστεί από||τις υπόλοιπες||αστυνομικές δυνάμεις, οι οποίες, αμέσως πριν, στα καλά καθούμενα, χτύπησαν σκληρά ένα||τμήμα της||διαδήλωσης σε σημείο όπου δεν είχε συμβεί τίποτα μέχρι τότε, έτσι για να ανάψουν||τα αίματα||και||να||παρασυρθούν οι διαδηλωτές εναντίον του (του τζιπ).||πρέπει να||παραδεχτούμε ότι είναι επαγγελματίες οι τύποι.||μόνο που είχαν σχεδιάσει αλλιώς τα πράγματα και αλλιώς τους βγήκαν.||γαμημένοι.||όπως δεν μάθαμε τίποτα για την piazza fontana, για το σταθμό της μπολώνιας, για τόσα πράγματα||από τη μαύρη περίοδο των anni di piombo, έτσι δεν θα πληρώσει κανείς για το θάνατο του παιδιού. ||βαγγέλης||από||ανέστιος ||παντοτινός 19/12/2007 1:40 μμ.||πρώτ'  απ'  όλα, προτείνω  να  ||μπαίνουν  ||με  φειδώ  ||οι  ||εικόνες  των  ||εκάστοτε  ||θυμάτων  ||ενόσω  ||κείτονται  άψυχα  όπου  γης.||εμπεδώσαμε  ότι  ||ο  ||κάρλο  ||δέχτηκε  τη  ||σφαίρα  ανάμεσα  ||στη  ||μύτη  ||και  ||την  ||κόγχη  του  ματιού.||έχουμε  γίνει  ||σχεδόν  ||νεκρόφιλοι||(τί  να  πω  για  ||κείνο  ||το  ||βίντεο  ||της  ||κηδείας  του  ||μιχάλη  ||που  ||έδειχνε  το  φέρετρο  ||ενώ  ||κατέβαινε  ||στον  ||τάφο;έλεος!).η  ||μνήμη  ||και  ||η  ||οργή  ||διατηρούνται  και  ||χωρίς  αυτά.||κατόπιν  ||διευκρινίζω  ότι  δεν  ||""καταδικάζω""  καμιά  τάση  μέσα  στο  ανταγωνιστικό  ||κίνημα.||κρατάω  τα  καλά  ||από  την  καθεμιά  και  προσπαθώ  ν'  ασκώ  σεμνή  και  λυσιτελή  κριτική  στα  υπόλοιπα  και  ||με  επίγνωση  ||της  ||εκάστοτε  ||θέσης  μου.||από  κει  και  ||μετά  περισσότερο  ||ξέρω  να  ||σου  πω  τί  ||η  ||ιστορία  και  ||η  ||εμπειρία  ||δείχνουν  ||ότι  ||δεν  πρέπει  να  προτείνει  κανείς  σ'  αυτές  τις  ||περιστάσεις  παρά  ||τί  ||προτείνω  ||εγώ  προσωπικά. ||τις  συνταγές  δεν  ||τις  ||έχει  κανείς  και  το  ξέρουμε:||από  ένα  ή  και  ||κάποια  ||μόνο  ||μυαλά  δεν  ||θα  ||έλθουν  ||ποτέ  δόκιμες  λύσεις.||ειδικά  όταν  ||""μιλάμε""  με  το  βάρος  ||ενός  ||δολοφονημένου  συντρόφου  στους  ώμους  ||μας.||αυτό  ||που  ||προτείνω, είναι  ν'  αφήσουμε  ||τις  ||συνταγές  και  ||ν'  αρχίσουμε  επιτέλους  να  μαγειρεύουμε.||ήτοι:- μου  ακούγεται  τουλάχιστον  κουλό  αυτό  ||που  ||λες  ||ότι  ||πήγε  ||να  ||κάνει  ||ο  τύπος  ||με  ||το  ||κόκκινο.||και  το   λέω  ||γιατί  ||θέλω  να  επισημάνω  ότι  ||η  ||εξεγερτική  πρακτική  του  black  block  ||είναι  πάντα  εξαιρετικά  ||ευάλωτη  ||σε  ||τέτοιες  διεισδύσεις  του  ||(βαθύ) κράτους.||δεν  ||παύουν  ||να  ||είναι  και  άλλες  πρακτικές, αλλά  εδώ  νομίζω  είναι  το...||αγαπημένο  πεδίο  ||της  ||εξουσίας  ||για  ||να  ||κάνει  ασκήσεις  επί  χάρτου - και  ||όπως  λέει  και  ||ο  ||από  κάτω  φίλος, είναι  ||μάνα  ||σ'  αυτό.||σε  προσχεδιασμένες  λοιπόν  συγκρούσεις, όπου μάλιστα  ο  αντίπαλος  σαφώς  υπερτερεί  σε  ισχύ  και  οριοθετεί  το  χώρο  ||και  ||το  χρόνο, δεν  ||πας  ||""αυθόρμητα""  να  τις  παίξεις, βασιζόμενος  ||στην  ορμή,  την  ||οργή  ||και  ||το  ||πλήθος  ||σου, και  ειδικά  ||μόλις  πριν  ||από  λίγες  μέρες  έχεις  ||βρεθεί  ||με  ||ένα  ||κάρο  ||άτομα  ||από  ||άλλες  χώρες  ||που  ||ούτε  γνωρίζεις  ||ούτε  προλαβαίνεις  ||να  ||συνεννοηθείς  ||μαζί  τους  στοιχειωδώς.||ο  ||κάρλο  ||πιθανόν  ||και  ||να  ||πλήρωσε  το  λάθος  που  έδωσε  γόνιμο  έδαφος  στην  εξουσία  ||να  ||στήσει  ||το  ||προκάτ  ||σκηνικό  ||που  είχε  σχεδιάσει.||όσον  αφορά  τη  στρατηγική  της  σύγκρουσης  λοιπόν||,ταπεινή  μου  γνώμη  ||απ'  την  εμπειρία  μου  είναι  ||ότι  ||στις  περιστάσεις  αυτές  βρίσκεσαι  ||από  πριν  ||σε  ||πολλές, μικρές, οργανωμένες, μιλημένες  ομάδες  ||που  έχουν  ||ξεκάθαρη  ||επιχειρησιακή  ||στόχευση  ||και  ||την  κάνουν  γρήγορα (χωρίς  ||και  ||πάλι  ||να  ||σου  εγγυάται  κανείς  ||ότι  δεν  θα  πάει  ||στραβά  ||κάτι).||το  μπούγιο  του  εξεγερτικού  κύματος  που  εμπνέεται κατά  ||βάση  ||από  ||το  πάθος  είναι  δόκιμο  ||γι'  αλλού -στην  περίπτωση  ||αυτή, όταν  το  ||κύμα  ||αποτραβήχτηκε, άφησε  πίσω  του  ||ένα  νεκρό  και, κυρίως, την  αδυναμία  του  ||να  ||πιέσει  ||μετέπειτα  ώστε  να  ||δικαιωθεί  ||η  μνήμη  ||του  στην  κοινωνία - γιατί  ||αυτές  ||οι  ||κινήσεις  δεν  έχουν  ||διάρκεια  και  συνοχή  ||παρά  μόνο  ||τη  στιγμή  που  βράζουν. ||μετά  κατακάθονται  ||μέχρι  το  επόμενο  ραντεβού.||- αυτό  που  περισσότερο  εμένα  με  ||νοιάζει  ||όμως, είναι  ακριβώς  ||αυτή  ||η  ||αδυναμία  ||που  ||προανέφερα, σε  ||σχέση  τώρα  ||με  το  ||όλο  κίνημα  ||της  ||αντιπαγκοσμιοποίησης.||στην  περίπτωση  ||αυτή, η  ||ανομοιογένεια, το  ετερόκλητο  του  πλήθους, η  σε  πολλές  περιπτώσεις  αποκλίνοντες  ||(ως  και  συγκρουόμενοι) στόχοι, η  διασπορά  του  μετά  ||τις  ||πορείες  σε  διαφορετικές  ||εγχώριες  πραγματικότητες  και  ||η  ||εγγενής  αδυναμία  της  άγνοιας  της  πραγματικότητας  ||της  ||χώρας  ||όπου  ||κάθε  φορά  συρρέει (που  αντιμετωπίζει  υποτυπωδώς  ||με  ενημερώσεις  και  προπαρασκευαστικές  συναντήσεις  λίγο  καιρό  πριν  ||ή  ||εκείνες  ||τις  μέρες) -||όλ'  αυτά  δεν  του  επέτρεψαν  στην  περίπτωση  του  κάρλο  να  σταθεί  στο  ύψος  του.||θα  έπρεπε  να  ||έχει  ||συστήσει  ειδική, διαρκή  legal  team  για  ||το  θέμα, που  να  ||το  κρατάει  ζωντανό  τουλάχιστον  ||για  όσο  καιρό  το  ||ιταλικό  κράτος  ||είχε  το  θράσος  να  στήνει  από  ||πάνω  και  ||δίκες, να  ||καλεί  ||περιοδικά  σε  παραστάσεις  ||έξω  ||από  ||τις  ||κατά  τόπους  ιταλικές  πρεσβείες, να  ||ορίσει  ||ξέρω  'γω  μια  ||μέρα  μνήμης  ||με  εκδηλώσεις  παντού  και  ||να  ||κινήσει  ||νομικές  διαδικασίες  ||(έστω...!) ενάντια   στις  ιταλικές   αρχές  για  το  φόνο  και  τη  γενικότερη  ||βία  ||εκείνων  ||των  ||ημερών:||να  μην  τους  ||αφήνει  σε  ησυχία  και  ||να  ||είναι  ||υπόλογοι  ||και  ||υπόδικοι  ||οι  ||δολοφόνοι, όχι  εμείς, όπως  συμβαίνει  ||σήμερα!αλλά  πώς  ||θα  ||μπορούσε  να  ||γίνει  αυτό  ||υπό  ||τις  ||συνθήκες  που  συγκροτείται; μάλλον  μόνο  σπασμωδικά, πρωτοβουλιακά  και  αν...||- τέλος, προτείνω  να  σταματήσει  ο  κόσμος  να  δαπανά  ||ενέργεια  ||σε  τέτοιες  διεθνείς  συγκεντρώσεις.||για  μένα  η  γένοβα  κατέδειξε - δυστυχώς  ||με  ||τραγικό  ||τρόπο - τα  όρια  ||και  ||τις  ||δυνατότητες  ||αυτής  ||της  ||συμμάζωξης.||ό,τι  ||τέλος  ||πάντων  ||πέτυχε  ||πέτυχε  και  ||ό,τι  ||έχασε  έχασε.||ήταν  σταθμός  και  τέρμα.||ο  ||καλύτερος  ||φόρος  ||τιμής  ||στον  ||κάρλο  είναι  αυτό  που  ||μεγάλο  ||μέρος  ||του  κόσμου  αυτού, είναι  αλήθεια, κάνει  στις  χώρες  του: δράσεις, στέκια, αγώνες, καταλήψεις, κοοπερατίβες, συγκρούσεις  κλπ.||δε  χρειάζεται  να  τρέχει  πίσω  ||από  το  κεφάλι  ||του  ψαριού  ||όπου  αυτό  ||αποφασίζει  να  κολυμπήσει, άσε  ||που  ||βρωμάει  ||κιόλας.||τί  δουλειά  έχει  ||η  ||επανάσταση  εκεί  που  το  ||χωροχρόνο  ||της  εκδίπλωσής  ||της  ||τον  ||ορίζουν  ||οι  ||εχθροί  της;μέχρι  ||να  ||το  καταλάβει, ίσως  θρηνήσεουμε  κι  άλλους  συντρόφους...||αυτά, φιλικά  και  ||με  όλη  την  επίγνωση  ότι  ||μπορεί  ||να  ||προβαίνω  σε  ||άκυρες  ||διαπιστώσεις  εφόσον  δεν  έχω  ||συμμετάσχει  σε  τέτοιου  είδους  διεργασίες.||για  να  ||πάψουν  ||να  ||υπάρχουν  ||αδικαίωτοι  κάρλο.||από @ 19/12/2007 2:02||μμ.||ενώ στο γενικό ύφος και προτάσεις συμφωνώ||σε όλο ο υπόλοιπο κομμάτι||θεωρώ ότι υποπίπτεις σε άκρως συνομωσιολογικά σενάρια για το τι έγινε σε σημείο τρομολαγνικό.||παρεπιμπτόντως||ο πυροσβεστήρας||που πήγε||να πετάξει πίσω||ουσιαστικά||ο||τζουλιάνι πρώτα||εκσφενδονίστηκε στο πλήθος από τον μπάτσο μέσα από το αστυνομικό τζιπάκι.||από ανέστιος ||παντοτινός 19/12/2007 2:23 μμ....||'ντάξει  δεν  ||θα  ||τα  ""χαλάσουμε""  στον  πυροσβεστήρα, ό,τι  ||κι  ||αν  ||πήγε  ||να  γίνει.||τώρα,  συνομωσιολόγος  να  'σαι  σίγουρος  δεν  είμαι.||μιλάω  για  ||κάτι  ||που  ||ουδείς  ||μπορεί  ||να  ||αμφισβητήσει:ότι  ||οι  ||κρατικοί  ||μηχανισμοί  ||τα  ||κάνουν  ||αυτά - ή  όχι; για  τη  γένοβα  δε  ειδικότερα, έχουν  κατά  καιρούς  δημοσιευτεί  διάφορα  σε  ||σχέση  ||με  ||προβοκατόρικες  ενέργειες.||φαίνεται  πως  εκεί  είχαν  δρομολογηθεί  πολλά  ||από  τους  μπάτσους.||τα  βασικά  είναι  ||τα  υπόλοιπα  ||κι  ||εκεί  γενικά  συμφωνούμε.||από||na bro to 20/12/2007 12:53 πμ."
